{
  "format_version": 1,
  "name": "Chess",
  "main_scene": "scene://chess/main",
  "scenes": [
    {
      "id": "scene://chess/main",
      "path": "scenes/main.scene.json"
    }
  ],
  "simulation": {
    "fixed_timestep": 0.016666667,
    "random_seed": 20260812
  },
  "input": {
    "actions": {
      "new_game": {
        "type": "button",
        "context": "gameplay",
        "bindings": [{ "input": "key:n" }]
      },
      "difficulty_easy": {
        "type": "button",
        "context": "gameplay",
        "bindings": [{ "input": "key:1" }]
      },
      "difficulty_medium": {
        "type": "button",
        "context": "gameplay",
        "bindings": [{ "input": "key:2" }]
      },
      "difficulty_hard": {
        "type": "button",
        "context": "gameplay",
        "bindings": [{ "input": "key:3" }]
      }
    }
  }
}
