{
  "format_version": 1,
  "name": "Minimal 2D Networking",
  "package_registry": "../../packages",
  "packages": {
    "demi.gameplay.controllers": "^1.0.0"
  },
  "main_scene": "scene://minimal_2d_networking/menu",
  "scenes": [
    {
      "id": "scene://minimal_2d_networking/menu",
      "path": "scenes/menu.scene.json"
    },
    {
      "id": "scene://minimal_2d_networking/platformer",
      "path": "scenes/platformer.scene.json"
    },
    {
      "id": "scene://minimal_2d_networking/spiral",
      "path": "scenes/spiral.scene.json"
    }
  ],
  "assets": [
    "asset://sprites/player",
    "asset://audio/death",
    "asset://items/gold_coin",
    "asset://audio/collect_coin"
  ],
  "input": {
    "actions": {
      "move": {
        "type": "axis1d",
        "context": "gameplay",
        "bindings": [
          {
            "input": "key:a",
            "scale": -1
          },
          {
            "input": "key:left",
            "scale": -1
          },
          {
            "input": "key:d",
            "scale": 1
          },
          {
            "input": "key:right",
            "scale": 1
          }
        ]
      },
      "jump": {
        "type": "button",
        "context": "gameplay",
        "bindings": [
          {
            "input": "key:space"
          },
          {
            "input": "key:w"
          },
          {
            "input": "key:up"
          }
        ]
      }
    }
  },
  "physics": {
    "layers": {
      "collectibles": [
        "player"
      ],
      "network": [
        "platform",
        "player"
      ],
      "platform": [
        "network",
        "player"
      ],
      "player": [
        "collectibles",
        "network",
        "platform"
      ]
    }
  },
  "scripting": {
    "language": "lua54",
    "modules": [
      "main_menu",
      "menu.actions"
    ]
  }
}
